Resume,Rank,Similarity Score,HR Remarks
vktfinal33.pdf,1,0.2282,"Subject: Resume Evaluation: vktfinal33.pdf - Candidate Ranking & Alignment Analysis

To: HR Department

This report analyzes the alignment of resume vktfinal33.pdf with the job description, resulting in a similarity score of 0.2282 and a ranking of #1.  While ranked first, the low similarity score indicates a significant gap between the candidate's presented skills and the job requirements.  Further investigation is crucial before proceeding with this candidate.

The most striking aspect of this evaluation is the complete absence of positive contributions.  This suggests a lack of explicit keywords or demonstrable experience directly matching the job description's core requirements.  The algorithm, despite ranking this resume first, has likely prioritized other factors, possibly related to the overall structure and formatting of the resume, rather than a strong content match.

The negative contributions highlight key areas of concern.  The presence of terms like ""jishu"" (likely a non-English term), ""66"" (ambiguous and potentially irrelevant), and ""highly"" (a vague descriptor) suggests the resume may contain irrelevant information or lacks precise language to showcase relevant skills.  These terms likely detract from the overall similarity score.

The negative contribution of ""aws"" (-0.0556) is particularly concerning given that cloud platforms are often crucial components of many technical roles.  The negative weight suggests either a lack of demonstrable experience with AWS or its mention in a context that doesn't align with the job requirements (e.g., mentioning AWS in a personal project unrelated to the target role).  Similar concerns exist regarding the absence of positive contributions related to Python, machine learning, and data analysis, which are typically core skills for many technical positions. The negative weight of ""administrative"" (-0.0481) further suggests that the candidate's experience may be heavily weighted towards administrative tasks rather than the technical skills the role demands.

The terms ""random,"""
Vskt cv.pdf,2,0.1664,"Subject: Candidate Vskt cv.pdf - Recruitment Analysis and Ranking Justification

To: HR Department

This report analyzes the alignment of candidate Vskt's resume (""Vskt cv.pdf"") with the job description, explaining the resulting similarity score of 0.1664 and rank #2.  The low similarity score indicates a significant gap between the candidate's presented skills and experience and the requirements outlined in the job description.  While the candidate has secured a respectable rank of #2, suggesting some relevant skills, a closer examination reveals crucial areas needing further investigation.

The absence of any ""Top Positive Contributions"" is a significant concern. This directly implies a lack of strong, direct matches between the resume content and the keywords or skills heavily weighted in the job description.  This suggests the candidate may lack demonstrable experience in core areas crucial for the role.

The ""Top Negative Contributions"" section provides valuable insights into the specific skill gaps.  The negative weights assigned to terms like ""analysis,"" ""engineer,"" ""developing,"" ""understanding,"" and ""proficient"" suggest a deficiency in showcasing demonstrable expertise in analytical thinking, engineering practices, software development, and technical proficiency.  These are fundamental skills likely required for the target role.  The candidate's resume may lack quantifiable achievements or detailed descriptions of projects demonstrating these capabilities.

Furthermore, the negative weights associated with ""AWS,"" ""problem,"" ""platforms,"" and ""sensor"" point to a potential lack of experience with cloud platforms (specifically AWS, which is a common requirement in many technical roles), problem-solving within a technical context, working with various software platforms, and experience with sensor technologies.  The low weight for ""algorithms"" suggests limited experience with algorithm design and implementation, which could be crucial depending on the specific technical requirements of the role.

The relatively low overall similarity score (0.1664) combined with the absence of positive contributions and the significant negative contributions strongly suggests"
Yashu_resume.pdf,3,0.0982,"To: HR Department
From: Technical Recruitment Analyst
Date: October 26, 2023
Subject: Resume Evaluation of Yashu_resume.pdf - Candidate Ranking #3

This report analyzes the alignment of Yashu's resume (Yashu_resume.pdf) with the job description, resulting in a similarity score of 0.0982 and a rank of #3.  This relatively low score indicates a significant gap between the candidate's presented skills and experience and the requirements outlined in the job description.  While the resume may contain some relevant information, substantial areas need improvement to better reflect the desired qualifications.

The most striking observation is the complete absence of positive contributions identified by the scoring algorithm. This suggests a lack of strong keywords or demonstrable experience directly matching the job description's core requirements.  The algorithm highlights several negative contributions, which further illuminate the misalignment.  The terms ""developing,"" ""proficient,"" and ""understanding,"" while common in resumes, appear to be negatively weighted in this analysis. This implies that the candidate's use of these terms may not effectively convey concrete skills and accomplishments relevant to the specific job requirements.  The resume likely lacks quantifiable achievements or specific examples demonstrating proficiency in the areas mentioned.

The negative weighting of ""AWS"" is particularly concerning, given that cloud platform experience (AWS or Azure) is likely a key requirement for many technical roles. The low score for ""platforms"" further reinforces this concern.  The presence of ""publication"" as a negative contributor suggests that while publications might be beneficial, their inclusion in this specific resume may be irrelevant or inappropriately emphasized given the job description's focus.

The negative weights associated with words like ""problem,"" ""things,"" and even ""home"" (potentially indicating a focus on personal projects rather than professional experience) suggest a lack of clarity and precision in describing relevant skills and accomplishments. The algorithm's negative weighting of ""20"
demo_resume.pdf,4,0.0973,"To: HR Department
From: Technical Recruitment Analysis
Date: October 26, 2023
Subject: Candidate Resume Evaluation - demo_resume.pdf

This report analyzes the alignment of the resume, demo_resume.pdf, with the job description for a technical role. The resume received a similarity score of 0.0973 and ranked #4 out of the applicant pool.  This relatively low score indicates a significant gap between the candidate's presented skills and experience and the requirements outlined in the job description.

A striking feature of the analysis is the absence of any positive contributions identified by the scoring system. This suggests a lack of strong, direct matches between the resume's content and the keywords or skills heavily weighted in the job description.  The candidate's resume appears to lack demonstrable experience in key areas crucial for the role.

The negative contributions highlight the specific areas where the candidate falls short.  The most significant negative contributions are related to:

* **""Science"" (-0.0779):** This suggests a potential lack of relevant scientific background or application of scientific principles, which may be a critical requirement for the role depending on its specific nature (e.g., data science, bioinformatics).  Further investigation is needed to determine if the candidate possesses transferable skills that could compensate for this gap.

* **""Python"" (-0.0572) and ""Developing"" (-0.0517):** These are substantial negative contributions.  Proficiency in Python is often a core requirement for many technical roles, particularly those involving data analysis, machine learning, or software development. The low score for ""developing"" suggests limited experience in software development or building applications.  This is a major area of concern.

* **""Admin"" (-0.0572), ""Platforms"" (-0.0379), ""EC2"" (-0.0329"
vresume.pdf,5,0.0876,"Subject: Candidate vresume.pdf - Recruitment Analysis and Ranking Justification

To: HR Department

This report analyzes the alignment of candidate vresume.pdf (Rank #5, Similarity Score 0.0876) with the job description.  The low similarity score and ranking indicate a significant gap between the candidate's profile and the required skillset. While certain positive contributions exist, several negative contributions significantly detract from the overall match.

**Positive Contributions:**

The analysis highlights two key positive contributions:

* **Content (527575612435.0827):** This exceptionally high positive contribution suggests the resume contains substantial relevant content.  However, the magnitude of this score is unusually large and warrants further investigation.  It's possible this reflects a flaw in the scoring algorithm, perhaps due to an unusually high word count or the presence of keywords unrelated to specific technical skills.  Further manual review is crucial to understand what aspects of the ""content"" drove this score.

* **AWS (0.0802):** This indicates the candidate possesses some experience with Amazon Web Services (AWS), a valuable skill for many technical roles.  The relatively low score suggests this experience might be limited in scope or depth compared to the job requirements.  We need to determine the extent of their AWS proficiency (e.g., specific services used, level of expertise) to assess its relevance.

**Negative Contributions:**

Several negative contributions significantly impact the candidate's ranking:

* **Challenging (-527575612435.0737):**  The extremely large negative contribution associated with ""challenging"" is concerning and, like the ""content"" score, requires careful manual review.  It suggests the resume may overemphasize less relevant experiences or use the term ""challenging"" excessively, potentially masking a lack of demonstrable technical skills.

* **Translator (-"
FARM EMBEDDED SECURITY SYSTEM.pdf,6,0.0522,"Subject: Resume Evaluation: FARM EMBEDDED SECURITY SYSTEM.pdf - Candidate #6

To: HR Department

This report analyzes the alignment of the resume ""FARM EMBEDDED SECURITY SYSTEM.pdf"" with the specified job description.  The resume received a low similarity score of 0.0522 and ranked #6, indicating a significant mismatch between the candidate's experience and the job requirements.  This low score is primarily driven by the significant negative contributions identified in the analysis.

The absence of positive contributions highlights a critical lack of direct alignment with the job description's key skills and experience requirements.  This suggests the candidate's experience, as presented, does not directly address the core competencies needed for the role.  Further investigation is required to understand if the candidate possesses transferable skills that could be relevant.

The top negative contributions reveal specific areas where the candidate's resume falls short:

* **Technology Stack Mismatch:** The negative contributions for ""aws"" (-0.0980), ""web"" (-0.0751), and ""platforms"" (-0.0555) strongly suggest a lack of experience with cloud platforms (specifically AWS, a common requirement in many technical roles) and web-based applications.  This is a major concern if the job description emphasizes cloud technologies or web development.

* **Software Development Gaps:** The negative weightings for ""application"" (-0.1511), ""developing"" (-0.0668), and ""engineer"" (-0.0577) indicate a potential deficiency in software development experience.  The magnitude of the ""application"" contribution suggests a particularly significant gap in this area.  This is crucial to assess as many technical roles require robust software development skills.

* **Data Analysis and Machine Learning Absence:** The negative contribution of ""analysis"" (-0.0647) raises concerns about the candidate's experience with data analysis techniques"
shubha_resume t.pdf,7,0.0437,"Subject: Resume Evaluation for Shubha - Job Application [Job Title]

To: HR Department

This report analyzes the alignment of Shubha's resume (shubha_resume t.pdf) with the requirements of the [Job Title] position.  The resume received a low similarity score of 0.0437 and ranked #7, indicating a significant mismatch between the candidate's profile and the job description.  This low score is primarily driven by the negative contributions identified by the automated system.

The absence of positive contributions highlights a critical lack of direct experience or skills explicitly mentioned in the job description.  The system failed to identify any keywords or phrases from the resume that strongly correlate with the required competencies for this role. This suggests a potential lack of relevant technical skills or experience in areas crucial for the position.

The top negative contributions provide valuable insights into the areas where Shubha's resume falls short.  The high negative weights associated with terms like ""ensuring,"" ""understanding,"" ""developing,"" and ""problem"" suggest that while the resume may mention these concepts, the context or depth of experience described is insufficient to meet the job requirements.  The negative weighting of ""engineer"" is particularly concerning, implying a potential lack of formal engineering experience or a misrepresentation of the candidate's technical capabilities.

Furthermore, the negative weights assigned to ""2018,"" ""unlimited,"" ""strong,"" and ""translator"" indicate potential issues with the resume's structure and content.  The presence of ""2018"" as a negative contribution suggests the resume may heavily emphasize older experience, potentially lacking recent relevant work.  ""Unlimited"" could indicate the use of vague or unsubstantiated claims, while ""strong"" might suggest overuse of generic adjectives without specific quantifiable achievements.  The presence of ""translator"" as a negative contribution suggests a potential mismatch between the candidate's background and the technical nature of the role.  Finally, the negative weight"
